{
  "report_id": "22222222-2222-2222-2222-222222222222",
  "project_id": "11111111-1111-1111-1111-111111111111",
  "related_id": "CH_001",
  "asset_id": "33333333-3333-3333-3333-333333333333",
  "asset_type": "character_front",
  "quality_score": 0.91,
  "face_consistency_score": 0.88,
  "outfit_consistency_score": 0.86,
  "scene_consistency_score": null,
  "prop_presence_score": null,
  "composition_score": 0.84,
  "issues": [],
  "retry_required": false,
  "retry_prompt_patch": "",
  "created_at": "2026-07-05T00:00:00Z"
}
